l,,,,,,,
l,l,l,,,,,
l l l,lll l l,lll l,ll,,,,
llll,l ll l ll ll,lll l l l lll l,lll ll l llll lll l l l ll l l l lll,llllll l,,,
,llll,ll llllllll l l lllllllll lllllll,l lll ll l lll ll l lllllll lll lll llll ll lll l llllllllll llll l,l l lllllll l llll l llll lll l ll l lll lllllllll l llll l l l l llllll l lll l,lllllll ll l lllllllll,lll,
,,,llllllllllllllll l ll lllllll lll llll l l,lllllll lllllll llll llll l l lllllllllllll l l ll lll lllll llllllll l lll l l l lllll lllllllllllll lllll llll lllll ll lllllllllllll lll lllll ll lllllllllll llllllll lll ll llllllllllllllll l l l l llllllll lll llllllllllllll ll ll lllllllllllllllllll,ll l ll lll llllllllllllllll l llll lll l llllllllllll l lll l l lllllllll lllllll ll lllll lllll lllllll ll l lllllllllllll ll llll llllll l l lllll l lllllllllll lllllll lllllllll lll l l llllllllllll ll lll lllllllllllll l lll llllllll l lllllllllll ll lllllll l llllllllllllllll l lll l l l lllllll l l l l ll lllll l l llll llll l l l ll llll l l l ll l lllllllllllllllll llllllll,llll l l l llll l ll l l lllllll llll l lll llll l l lllllll l llll l lll l l l l l lll l llll l lllllll l lllll l lllll lllllllll l lllllllll,llllllllllllllllllll
